{"artifacts":[{"brotli_bytes":1315462,"brotli_sha256":"6d85b3883e648e2617ef96e30b0738a271c43107906ff187d057568382cb0228","decoded_bytes":3964880,"exposure":"public","owner":"runtime","path":"assets/application-bundle-d8c37518a38ef75511f59f91cdaf5385ebc0e0c688dccfdc311924248f4391e1.avm","role":"application-bundle","source_sha256":"d8c37518a38ef75511f59f91cdaf5385ebc0e0c688dccfdc311924248f4391e1"},{"brotli_bytes":2172,"brotli_sha256":"1c81678fc6347df307bb1d2857c1ab794f77935666353e66588b49a5f7c6e380","decoded_bytes":7599,"exposure":"public","owner":"loader-bootstrap","path":"assets/browser-host-9be31e27627a293f7d2c45974ca1c98cd199c9924a4b3d5e7d7c29d17f398e78.js","role":"browser-host","source_sha256":"9be31e27627a293f7d2c45974ca1c98cd199c9924a4b3d5e7d7c29d17f398e78"},{"brotli_bytes":1117,"brotli_sha256":"eaae85ebe19a44b870fc2c57e2408f51ef70a512be97544550d7ca873342586f","decoded_bytes":2124,"exposure":"public","owner":"application","path":"assets/feature-counter-fc3e56e3ac55ff42fa210aff2a8e040fe194262cc4ec9f3083aa486c4363585d.avm","role":"feature-bundle","source_sha256":"fc3e56e3ac55ff42fa210aff2a8e040fe194262cc4ec9f3083aa486c4363585d"},{"brotli_bytes":30831,"brotli_sha256":"d5df3b6f9cacacece829d8dedbd65e03d88f7dfcf4ef44e033e7dda8d8b3bb94","decoded_bytes":156421,"exposure":"public","owner":"loader-bootstrap","path":"assets/runtime-module-43cbf6ec34cd4745777b4ce70aa23844a6bb8af44c301c86a5dd02c0165bef64.mjs","role":"runtime-module","source_sha256":"43cbf6ec34cd4745777b4ce70aa23844a6bb8af44c301c86a5dd02c0165bef64"},{"brotli_bytes":254829,"brotli_sha256":"92fa4ecbcaee308499e464ae72521a8522020f2720bd9717e7facc63b72ac00e","decoded_bytes":986537,"exposure":"public","owner":"runtime","path":"assets/runtime-wasm-d20c491e75936dc8189910c8d0740093b7813d8dcc1cf966a87c011799ade9d8.wasm","role":"runtime-wasm","source_sha256":"d20c491e75936dc8189910c8d0740093b7813d8dcc1cf966a87c011799ade9d8"},{"brotli_bytes":1142,"brotli_sha256":"314ca5db8efd9b84d1ad82c8ab89b1af0e1fd8f076d3a74cd759a835d6c0ce26","decoded_bytes":4392,"exposure":"public","owner":"loader-bootstrap","path":"build-manifest.json","role":"build-manifest","source_sha256":"c115777a23bead3963cef9341d0cd6df797ea6f607bae19080acbb21535338d3"},{"brotli_bytes":259,"brotli_sha256":"d74a4b38ccad818ce35728f8308132a3855d960e4e85d6a53ee72efee75aa7f8","decoded_bytes":528,"exposure":"public","owner":"loader-bootstrap","path":"index.html","role":"document","source_sha256":"35f732eadc215c3c9ce8022cb1701fee4efa83a910c81ad50363d7520181b65f"}],"budgets":[{"direction":"at-most","id":"application-brotli","metric":"brotli_bytes","observed":1117,"owner":"application","result":"passed","threshold":256000},{"direction":"at-most","id":"application-decoded","metric":"decoded_bytes","observed":2124,"owner":"application","result":"passed","threshold":716800},{"direction":"at-most","id":"loader-brotli","metric":"brotli_bytes","observed":34404,"owner":"loader-bootstrap","result":"passed","threshold":35840},{"direction":"exactly","id":"public-source-maps","metric":"source_map_bytes","observed":0,"owner":"public","result":"passed","threshold":0},{"direction":"at-most","id":"runtime-brotli","metric":"brotli_bytes","observed":1570291,"owner":"runtime","result":"passed","threshold":1638400}],"complete":true,"compression":{"algorithm":"brotli","implementation":"node-zlib","quality":11,"repetitions":3},"decision":"accept","phase":9,"policy_id":"blazex.bh06.payload/2","policy_sha256":"a18e4d2213f862ff3ebdfd2be4a681983d2e6967fa63a0167bc73283bcd00481","schema_version":"1.0.0","status":"complete","summary":{"failed_budgets":0,"manifest_artifacts":13,"private_artifacts":7,"public_artifacts":7,"public_brotli_bytes":1605812,"public_decoded_bytes":5122481,"public_source_maps":0},"totals":{"application":{"artifacts":1,"brotli_bytes":1117,"decoded_bytes":2124},"loader-bootstrap":{"artifacts":4,"brotli_bytes":34404,"decoded_bytes":168940},"runtime":{"artifacts":2,"brotli_bytes":1570291,"decoded_bytes":4951417}}}
