{"artifacts":[{"brotli_bytes":2434969,"brotli_sha256":"c50ce74583ffa3202cb078b50fbc7b1867fd08d7e1c739f4db881434b1125a35","decoded_bytes":7347504,"exposure":"public","owner":"runtime","path":"assets/application-bundle-d7243d935d1b0f51b0bf2a96e3b08108c394c79e17a5224cfde0b60edac612c5.avm","role":"application-bundle","source_sha256":"d7243d935d1b0f51b0bf2a96e3b08108c394c79e17a5224cfde0b60edac612c5"},{"brotli_bytes":2168,"brotli_sha256":"87b32b9761b29fc6cc2eed4f0638bf0a0b457cc751869b03c2ce0733b749c820","decoded_bytes":7543,"exposure":"public","owner":"loader-bootstrap","path":"assets/browser-host-f39d1894a45fde0ddebe7867745071129c255311eea3395c9d32459fade7133d.js","role":"browser-host","source_sha256":"f39d1894a45fde0ddebe7867745071129c255311eea3395c9d32459fade7133d"},{"brotli_bytes":1117,"brotli_sha256":"eaae85ebe19a44b870fc2c57e2408f51ef70a512be97544550d7ca873342586f","decoded_bytes":2124,"exposure":"public","owner":"application","path":"assets/feature-counter-fc3e56e3ac55ff42fa210aff2a8e040fe194262cc4ec9f3083aa486c4363585d.avm","role":"feature-bundle","source_sha256":"fc3e56e3ac55ff42fa210aff2a8e040fe194262cc4ec9f3083aa486c4363585d"},{"brotli_bytes":30831,"brotli_sha256":"d5df3b6f9cacacece829d8dedbd65e03d88f7dfcf4ef44e033e7dda8d8b3bb94","decoded_bytes":156421,"exposure":"public","owner":"loader-bootstrap","path":"assets/runtime-module-43cbf6ec34cd4745777b4ce70aa23844a6bb8af44c301c86a5dd02c0165bef64.mjs","role":"runtime-module","source_sha256":"43cbf6ec34cd4745777b4ce70aa23844a6bb8af44c301c86a5dd02c0165bef64"},{"brotli_bytes":254829,"brotli_sha256":"92fa4ecbcaee308499e464ae72521a8522020f2720bd9717e7facc63b72ac00e","decoded_bytes":986537,"exposure":"public","owner":"runtime","path":"assets/runtime-wasm-d20c491e75936dc8189910c8d0740093b7813d8dcc1cf966a87c011799ade9d8.wasm","role":"runtime-wasm","source_sha256":"d20c491e75936dc8189910c8d0740093b7813d8dcc1cf966a87c011799ade9d8"},{"brotli_bytes":1079,"brotli_sha256":"9ddc23340115c1925996c59d2ac2851c240d3953e17b7703338d2dad56eac9b9","decoded_bytes":4070,"exposure":"public","owner":"loader-bootstrap","path":"build-manifest.json","role":"build-manifest","source_sha256":"11c393b9ebc03bed2e118c680d712e9de6c69f1fadc0799e377a853c2ebaca58"},{"brotli_bytes":260,"brotli_sha256":"e9c413dc33c03d645f33c48613f7c2305e363c27e82e2cadfa358b7e7ec78a93","decoded_bytes":528,"exposure":"public","owner":"loader-bootstrap","path":"index.html","role":"document","source_sha256":"9281e8ea60ad6016ef0adfe9447d13a902a60097a44326e17328abe87439a50a"}],"budgets":[{"direction":"at-most","id":"application-brotli","metric":"brotli_bytes","observed":1117,"owner":"application","result":"passed","threshold":256000},{"direction":"at-most","id":"application-decoded","metric":"decoded_bytes","observed":2124,"owner":"application","result":"passed","threshold":716800},{"direction":"at-most","id":"loader-brotli","metric":"brotli_bytes","observed":34338,"owner":"loader-bootstrap","result":"passed","threshold":35840},{"direction":"exactly","id":"public-source-maps","metric":"source_map_bytes","observed":0,"owner":"public","result":"passed","threshold":0},{"direction":"at-most","id":"runtime-brotli","metric":"brotli_bytes","observed":2689798,"owner":"runtime","result":"failed","threshold":1638400}],"complete":true,"compression":{"algorithm":"brotli","implementation":"node-zlib","quality":11,"repetitions":3},"decision":"reject","phase":8,"policy_id":"blazex.bh06.payload/1","policy_sha256":"b55df04e35907ca53316fe249512609cc90aed16923dac3813f4f45ed8e3e253","schema_version":"1.0.0","status":"complete","summary":{"failed_budgets":1,"manifest_artifacts":12,"private_artifacts":6,"public_artifacts":7,"public_brotli_bytes":2725253,"public_decoded_bytes":8504727,"public_source_maps":0},"totals":{"application":{"artifacts":1,"brotli_bytes":1117,"decoded_bytes":2124},"loader-bootstrap":{"artifacts":4,"brotli_bytes":34338,"decoded_bytes":168562},"runtime":{"artifacts":2,"brotli_bytes":2689798,"decoded_bytes":8334041}}}
